test_asa_classifier/20260428-093917_asa_vitaldb_v1/ecg/summary.json

{
  "input_mode": "ecg",
  "cv_folds": [
    {
      "fold": 1,
      "train_cases": 3831,
      "val_cases": 958,
      "train_subjects": 3670,
      "val_subjects": 920,
      "best_epoch": 6,
      "val_case": {
        "n": 958,
        "accuracy": 0.44572025052192066,
        "balanced_accuracy": 0.46112072578085544,
        "macro_f1": 0.4068604381529794,
        "weighted_f1": 0.44700133122975516,
        "confusion_matrix": [
          [
            193,
            68,
            22
          ],
          [
            267,
            198,
            109
          ],
          [
            30,
            35,
            36
          ]
        ],
        "classification_report": {
          "ASA1": {
            "precision": 0.39387755102040817,
            "recall": 0.6819787985865724,
            "f1-score": 0.49935316946959896,
            "support": 283.0
          },
          "ASA2": {
            "precision": 0.6578073089700996,
            "recall": 0.34494773519163763,
            "f1-score": 0.45257142857142857,
            "support": 574.0
          },
          "ASA3": {
            "precision": 0.2155688622754491,
            "recall": 0.3564356435643564,
            "f1-score": 0.26865671641791045,
            "support": 101.0
          },
          "accuracy": 0.44572025052192066,
          "macro avg": {
            "precision": 0.4224179074219856,
            "recall": 0.46112072578085544,
            "f1-score": 0.4068604381529794,
            "support": 958.0
          },
          "weighted avg": {
            "precision": 0.5332162811872997,
            "recall": 0.44572025052192066,
            "f1-score": 0.44700133122975516,
            "support": 958.0
          }
        },
        "roc_auc_ovr_macro": 0.6465854455254879,
        "pr_auc_macro": 0.4488520747981029
      },
      "val_window": {
        "n": 18202,
        "accuracy": 0.4352268981430612,
        "balanced_accuracy": 0.4565624306836946,
        "macro_f1": 0.3997941373793911,
        "weighted_f1": 0.44155663704269466,
        "confusion_matrix": [
          [
            3439,
            1302,
            636
          ],
          [
            4836,
            3740,
            2330
          ],
          [
            589,
            587,
            743
          ]
        ],
        "classification_report": {
          "ASA1": {
            "precision": 0.38797382671480146,
            "recall": 0.6395759717314488,
            "f1-score": 0.4829717014254617,
            "support": 5377.0
          },
          "ASA2": {
            "precision": 0.6644164149937822,
            "recall": 0.3429304969741427,
            "f1-score": 0.4523737526459026,
            "support": 10906.0
          },
          "ASA3": {
            "precision": 0.20032353734160152,
            "recall": 0.3871808233454924,
            "f1-score": 0.2640369580668088,
            "support": 1919.0
          },
          "accuracy": 0.4352268981430612,
          "macro avg": {
            "precision": 0.4175712596833951,
            "recall": 0.4565624306836946,
            "f1-score": 0.3997941373793911,
            "support": 18202.0
          },
          "weighted avg": {
            "precision": 0.5338249399146363,
            "recall": 0.4352268981430612,
            "f1-score": 0.44155663704269466,
            "support": 18202.0
          }
        },
        "roc_auc_ovr_macro": 0.6285851245881119,
        "pr_auc_macro": 0.4256441422195986
      }
    },
    {
      "fold": 2,
      "train_cases": 3831,
      "val_cases": 958,
      "train_subjects": 3674,
      "val_subjects": 916,
      "best_epoch": 1,
      "val_case": {
        "n": 958,
        "accuracy": 0.32045929018789143,
        "balanced_accuracy": 0.45843746290882276,
        "macro_f1": 0.27683017487795336,
        "weighted_f1": 0.20192576174304874,
        "confusion_matrix": [
          [
            246,
            2,
            35
          ],
          [
            413,
            12,
            149
          ],
          [
            49,
            3,
            49
          ]
        ],
        "classification_report": {
          "ASA1": {
            "precision": 0.3474576271186441,
            "recall": 0.8692579505300353,
            "f1-score": 0.496468213925328,
            "support": 283.0
          },
          "ASA2": {
            "precision": 0.7058823529411765,
            "recall": 0.020905923344947737,
            "f1-score": 0.04060913705583756,
            "support": 574.0
          },
          "ASA3": {
            "precision": 0.21030042918454936,
            "recall": 0.48514851485148514,
            "f1-score": 0.2934131736526946,
            "support": 101.0
          },
          "accuracy": 0.32045929018789143,
          "macro avg": {
            "precision": 0.42121346974812335,
            "recall": 0.45843746290882276,
            "f1-score": 0.27683017487795336,
            "support": 958.0
          },
          "weighted avg": {
            "precision": 0.5477529461486963,
            "recall": 0.32045929018789143,
            "f1-score": 0.20192576174304874,
            "support": 958.0
          }
        },
        "roc_auc_ovr_macro": 0.6227597330922366,
        "pr_auc_macro": 0.42903647441805864
      },
      "val_window": {
        "n": 18202,
        "accuracy": 0.31024063289748377,
        "balanced_accuracy": 0.43790877766819375,
        "macro_f1": 0.27250093009276116,
        "weighted_f1": 0.2140577833775753,
        "confusion_matrix": [
          [
            4311,
            142,
            924
          ],
          [
            7335,
            429,
            3142
          ],
          [
            939,
            73,
            907
          ]
        ],
        "classification_report": {
          "ASA1": {
            "precision": 0.3425506555423123,
            "recall": 0.8017481867212201,
            "f1-score": 0.4800133615410311,
            "support": 5377.0
          },
          "ASA2": {
            "precision": 0.6661490683229814,
            "recall": 0.03933614524115166,
            "f1-score": 0.07428571428571429,
            "support": 10906.0
          },
          "ASA3": {
            "precision": 0.18238487834305248,
            "recall": 0.4726420010422095,
            "f1-score": 0.263203714451538,
            "support": 1919.0
          },
          "accuracy": 0.31024063289748377,
          "macro avg": {
            "precision": 0.3970282007361154,
            "recall": 0.43790877766819375,
            "f1-score": 0.27250093009276116,
            "support": 18202.0
          },
          "weighted avg": {
            "precision": 0.5195535213450041,
            "recall": 0.31024063289748377,
            "f1-score": 0.2140577833775753,
            "support": 18202.0
          }
        },
        "roc_auc_ovr_macro": 0.6048340917850609,
        "pr_auc_macro": 0.4005460593975035
      }
    },
    {
      "fold": 3,
      "train_cases": 3831,
      "val_cases": 958,
      "train_subjects": 3673,
      "val_subjects": 917,
      "best_epoch": 12,
      "val_case": {
        "n": 958,
        "accuracy": 0.5281837160751566,
        "balanced_accuracy": 0.49186203571293463,
        "macro_f1": 0.46260801617944475,
        "weighted_f1": 0.5377877184841098,
        "confusion_matrix": [
          [
            113,
            140,
            30
          ],
          [
            114,
            345,
            115
          ],
          [
            8,
            45,
            48
          ]
        ],
        "classification_report": {
          "ASA1": {
            "precision": 0.4808510638297872,
            "recall": 0.3992932862190813,
            "f1-score": 0.4362934362934363,
            "support": 283.0
          },
          "ASA2": {
            "precision": 0.6509433962264151,
            "recall": 0.6010452961672473,
            "f1-score": 0.625,
            "support": 574.0
          },
          "ASA3": {
            "precision": 0.24870466321243523,
            "recall": 0.4752475247524752,
            "f1-score": 0.32653061224489793,
            "support": 101.0
          },
          "accuracy": 0.5281837160751566,
          "macro avg": {
            "precision": 0.46016637442287917,
            "recall": 0.49186203571293463,
            "f1-score": 0.46260801617944475,
            "support": 958.0
          },
          "weighted avg": {
            "precision": 0.5582896988332443,
            "recall": 0.5281837160751565,
            "f1-score": 0.5377877184841098,
            "support": 958.0
          }
        },
        "roc_auc_ovr_macro": 0.6606618630972373,
        "pr_auc_macro": 0.4459857076884915
      },
      "val_window": {
        "n": 18202,
        "accuracy": 0.4949456103724865,
        "balanced_accuracy": 0.4626340998134523,
        "macro_f1": 0.4307813401780491,
        "weighted_f1": 0.5083170948902795,
        "confusion_matrix": [
          [
            1983,
            2619,
            775
          ],
          [
            2332,
            6153,
            2421
          ],
          [
            179,
            867,
            873
          ]
        ],
        "classification_report": {
          "ASA1": {
            "precision": 0.44125500667556744,
            "recall": 0.36879300725311515,
            "f1-score": 0.401783000709148,
            "support": 5377.0
          },
          "ASA2": {
            "precision": 0.6383442265795207,
            "recall": 0.5641848523748395,
            "f1-score": 0.5989778534923339,
            "support": 10906.0
          },
          "ASA3": {
            "precision": 0.21454902924551486,
            "recall": 0.45492443981240227,
            "f1-score": 0.29158316633266534,
            "support": 1919.0
          },
          "accuracy": 0.4949456103724865,
          "macro avg": {
            "precision": 0.4313827541668676,
            "recall": 0.4626340998134523,
            "f1-score": 0.4307813401780491,
            "support": 18202.0
          },
          "weighted avg": {
            "precision": 0.5354428026092145,
            "recall": 0.4949456103724865,
            "f1-score": 0.5083170948902795,
            "support": 18202.0
          }
        },
        "roc_auc_ovr_macro": 0.6348072221334587,
        "pr_auc_macro": 0.42422475451241226
      }
    },
    {
      "fold": 4,
      "train_cases": 3831,
      "val_cases": 958,
      "train_subjects": 3674,
      "val_subjects": 916,
      "best_epoch": 5,
      "val_case": {
        "n": 958,
        "accuracy": 0.33507306889352817,
        "balanced_accuracy": 0.4428821965597489,
        "macro_f1": 0.2979885572039717,
        "weighted_f1": 0.23677522778974155,
        "confusion_matrix": [
          [
            249,
            8,
            27
          ],
          [
            451,
            32,
            90
          ],
          [
            51,
            10,
            40
          ]
        ],
        "classification_report": {
          "ASA1": {
            "precision": 0.33155792276964047,
            "recall": 0.8767605633802817,
            "f1-score": 0.4811594202898551,
            "support": 284.0
          },
          "ASA2": {
            "precision": 0.64,
            "recall": 0.055846422338568937,
            "f1-score": 0.10272873194221509,
            "support": 573.0
          },
          "ASA3": {
            "precision": 0.25477707006369427,
            "recall": 0.39603960396039606,
            "f1-score": 0.31007751937984496,
            "support": 101.0
          },
          "accuracy": 0.33507306889352817,
          "macro avg": {
            "precision": 0.4087783309444449,
            "recall": 0.4428821965597489,
            "f1-score": 0.2979885572039717,
            "support": 958.0
          },
          "weighted avg": {
            "precision": 0.5079487830302829,
            "recall": 0.33507306889352817,
            "f1-score": 0.23677522778974155,
            "support": 958.0
          }
        },
        "roc_auc_ovr_macro": 0.6137342128234948,
        "pr_auc_macro": 0.40208574093101374
      },
      "val_window": {
        "n": 18202,
        "accuracy": 0.3367212394242391,
        "balanced_accuracy": 0.432866088548628,
        "macro_f1": 0.3014900628471992,
        "weighted_f1": 0.25632130962942423,
        "confusion_matrix": [
          [
            4527,
            301,
            568
          ],
          [
            8140,
            874,
            1873
          ],
          [
            948,
            243,
            728
          ]
        ],
        "classification_report": {
          "ASA1": {
            "precision": 0.33250091810503124,
            "recall": 0.838954781319496,
            "f1-score": 0.4762505917626637,
            "support": 5396.0
          },
          "ASA2": {
            "precision": 0.616361071932299,
            "recall": 0.08027923211169284,
            "f1-score": 0.14205607476635515,
            "support": 10887.0
          },
          "ASA3": {
            "precision": 0.2297254654465131,
            "recall": 0.37936425221469516,
            "f1-score": 0.2861635220125786,
            "support": 1919.0
          },
          "accuracy": 0.3367212394242391,
          "macro avg": {
            "precision": 0.39286248516128114,
            "recall": 0.432866088548628,
            "f1-score": 0.3014900628471992,
            "support": 18202.0
          },
          "weighted avg": {
            "precision": 0.4914482536212255,
            "recall": 0.3367212394242391,
            "f1-score": 0.25632130962942423,
            "support": 18202.0
          }
        },
        "roc_auc_ovr_macro": 0.5988261010829286,
        "pr_auc_macro": 0.3909422553486457
      }
    },
    {
      "fold": 5,
      "train_cases": 3832,
      "val_cases": 957,
      "train_subjects": 3669,
      "val_subjects": 921,
      "best_epoch": 10,
      "val_case": {
        "n": 957,
        "accuracy": 0.4346917450365726,
        "balanced_accuracy": 0.48661525357390234,
        "macro_f1": 0.40752280374921884,
        "weighted_f1": 0.43333686599789395,
        "confusion_matrix": [
          [
            196,
            49,
            38
          ],
          [
            268,
            173,
            132
          ],
          [
            30,
            24,
            47
          ]
        ],
        "classification_report": {
          "ASA1": {
            "precision": 0.3967611336032389,
            "recall": 0.6925795053003534,
            "f1-score": 0.5045045045045045,
            "support": 283.0
          },
          "ASA2": {
            "precision": 0.7032520325203252,
            "recall": 0.3019197207678883,
            "f1-score": 0.42246642246642246,
            "support": 573.0
          },
          "ASA3": {
            "precision": 0.21658986175115208,
            "recall": 0.46534653465346537,
            "f1-score": 0.29559748427672955,
            "support": 101.0
          },
          "accuracy": 0.4346917450365726,
          "macro avg": {
            "precision": 0.4388676759582388,
            "recall": 0.48661525357390234,
            "f1-score": 0.40752280374921884,
            "support": 957.0
          },
          "weighted avg": {
            "precision": 0.5612564174302291,
            "recall": 0.4346917450365726,
            "f1-score": 0.43333686599789395,
            "support": 957.0
          }
        },
        "roc_auc_ovr_macro": 0.6367926939193036,
        "pr_auc_macro": 0.44585006268483734
      },
      "val_window": {
        "n": 18183,
        "accuracy": 0.42347247428917123,
        "balanced_accuracy": 0.46311615339830725,
        "macro_f1": 0.3947841936748198,
        "weighted_f1": 0.42943651179704273,
        "confusion_matrix": [
          [
            3393,
            1206,
            778
          ],
          [
            4730,
            3462,
            2695
          ],
          [
            580,
            494,
            845
          ]
        ],
        "classification_report": {
          "ASA1": {
            "precision": 0.38986556359875907,
            "recall": 0.6310210154361168,
            "f1-score": 0.48196022727272725,
            "support": 5377.0
          },
          "ASA2": {
            "precision": 0.6706702828361101,
            "recall": 0.3179939377238909,
            "f1-score": 0.4314287494547947,
            "support": 10887.0
          },
          "ASA3": {
            "precision": 0.19569245020842982,
            "recall": 0.44033350703491403,
            "f1-score": 0.2709636042969376,
            "support": 1919.0
          },
          "accuracy": 0.42347247428917123,
          "macro avg": {
            "precision": 0.4187427655477663,
            "recall": 0.46311615339830725,
            "f1-score": 0.3947841936748198,
            "support": 18183.0
          },
          "weighted avg": {
            "precision": 0.5375036196808687,
            "recall": 0.42347247428917123,
            "f1-score": 0.42943651179704273,
            "support": 18183.0
          }
        },
        "roc_auc_ovr_macro": 0.6213540475862257,
        "pr_auc_macro": 0.42394641943793626
      }
    }
  ],
  "cv_case_macro_f1_mean": 0.37036199803271364,
  "cv_case_macro_f1_std": 0.07100493835879906,
  "final_epochs": 6,
  "final_info": {
    "history": [
      {
        "epoch": 1,
        "train_loss": 1.0972474856223677,
        "train_accuracy": 0.32908749216955524
      },
      {
        "epoch": 2,
        "train_loss": 1.0749338821351768,
        "train_accuracy": 0.303205811563781
      },
      {
        "epoch": 3,
        "train_loss": 1.0608735613482252,
        "train_accuracy": 0.31944917629216074
      },
      {
        "epoch": 4,
        "train_loss": 1.05417187438898,
        "train_accuracy": 0.332285610664791
      },
      {
        "epoch": 5,
        "train_loss": 1.0448023009804104,
        "train_accuracy": 0.36514600345089077
      },
      {
        "epoch": 6,
        "train_loss": 1.0381695275736893,
        "train_accuracy": 0.37908144761569823
      }
    ],
    "epochs": 6,
    "normalizer": {
      "mean": 0.027691758183473462,
      "std": 0.5208833328349745
    },
    "class_weights": [
      1.1273540258407593,
      0.5566015839576721,
      3.1610560417175293
    ],
    "train_windows": 90991
  },
  "test_case": {
    "n": 1198,
    "accuracy": 0.3113522537562604,
    "balanced_accuracy": 0.40341373633002925,
    "macro_f1": 0.2766969106483173,
    "weighted_f1": 0.2530739994335544,
    "confusion_matrix": [
      [
        263,
        20,
        71
      ],
      [
        425,
        62,
        231
      ],
      [
        62,
        16,
        48
      ]
    ],
    "classification_report": {
      "ASA1": {
        "precision": 0.3506666666666667,
        "recall": 0.7429378531073446,
        "f1-score": 0.47644927536231885,
        "support": 354.0
      },
      "ASA2": {
        "precision": 0.6326530612244898,
        "recall": 0.08635097493036212,
        "f1-score": 0.15196078431372548,
        "support": 718.0
      },
      "ASA3": {
        "precision": 0.13714285714285715,
        "recall": 0.38095238095238093,
        "f1-score": 0.20168067226890757,
        "support": 126.0
      },
      "accuracy": 0.3113522537562604,
      "macro avg": {
        "precision": 0.37348752834467125,
        "recall": 0.40341373633002925,
        "f1-score": 0.2766969106483173,
        "support": 1198.0
      },
      "weighted avg": {
        "precision": 0.4972127695819563,
        "recall": 0.3113522537562604,
        "f1-score": 0.2530739994335544,
        "support": 1198.0
      }
    },
    "roc_auc_ovr_macro": 0.5994965698755873,
    "pr_auc_macro": 0.39624025835266913
  },
  "test_window": {
    "n": 22762,
    "accuracy": 0.3126702398734733,
    "balanced_accuracy": 0.4076462223970294,
    "macro_f1": 0.28285153411047664,
    "weighted_f1": 0.2611535404522924,
    "confusion_matrix": [
      [
        4821,
        504,
        1401
      ],
      [
        7863,
        1315,
        4464
      ],
      [
        1151,
        262,
        981
      ]
    ],
    "classification_report": {
      "ASA1": {
        "precision": 0.348464040477051,
        "recall": 0.7167707404103479,
        "f1-score": 0.46894606293468216,
        "support": 6726.0
      },
      "ASA2": {
        "precision": 0.6319077366650648,
        "recall": 0.09639349069051459,
        "f1-score": 0.16727087705908542,
        "support": 13642.0
      },
      "ASA3": {
        "precision": 0.14329535495179668,
        "recall": 0.40977443609022557,
        "f1-score": 0.21233766233766233,
        "support": 2394.0
      },
      "accuracy": 0.3126702398734733,
      "macro avg": {
        "precision": 0.37455571069797083,
        "recall": 0.4076462223970294,
        "f1-score": 0.28285153411047664,
        "support": 22762.0
      },
      "weighted avg": {
        "precision": 0.4967623038216352,
        "recall": 0.3126702398734733,
        "f1-score": 0.2611535404522924,
        "support": 22762.0
      }
    },
    "roc_auc_ovr_macro": 0.5870485423735654,
    "pr_auc_macro": 0.3816605304721998
  }
}

test_asa_classifier/20260428-093917_asa_vitaldb_v1/scorecard.md

### Test case metrics

- n: 1198
- accuracy: 0.3114
- balanced_accuracy: 0.4034
- macro_f1: 0.2767
- weighted_f1: 0.2531
- roc_auc_ovr_macro: 0.5995
- pr_auc_macro: 0.3962
- confusion_matrix: [[263, 20, 71], [425, 62, 231], [62, 16, 48]]